{
  "card_id": "xai_s01_student_hint_001",
  "scenario_id": "S01",
  "audience": "student",
  "judgment": {
    "summary": "이 구간은 지니 불순도와 엔트로피를 비교하는 부분이라, 먼저 엔트로피 정의를 짧게 확인하면 다음 설명이 더 잘 이어집니다.",
    "decision_type": "recommend",
    "confidence": 0.72
  },
  "evidence": [
    {
      "source_event": "evt_s01_video_pause_001",
      "claim": "같은 구간에서 멈춤과 재시청이 집중되었습니다.",
      "weight": 0.42
    },
    {
      "source_event": "evt_s01_checkpoint_submit_001",
      "claim": "확인 문제에서 엔트로피 정의 선택지가 흔들렸습니다.",
      "weight": 0.31
    }
  ],
  "model": {
    "name": "segment_support_policy",
    "version": "0.1.0",
    "run_id": "run_s01_student_hint_001"
  },
  "uncertainty": {
    "summary": "현재 판단은 학습 행동 신호만 사용하며, 컨디션이나 외부 일정은 알지 못합니다.",
    "interval_or_reason": "support_fit_estimate=0.64-0.78"
  },
  "recommended_action": {
    "action_id": "act_s01_student_hint_pack",
    "label": "엔트로피 정의 3분 복습과 예시 문제 1개를 먼저 봅니다.",
    "owner": "student",
    "requires_approval": true
  },
  "measurement_plan": {
    "measurement_id": "measure_s01_hint_effect_001",
    "metric": "next_checkpoint_correctness",
    "method": "pre_post",
    "reevaluate_at": "2026-04-10T10:35:00+09:00"
  },
  "governance": {
    "data_scope": ["video.segment.pause", "checkpoint.answer.submit"],
    "privacy_level": "pseudonymous",
    "approval_gate": "G1",
    "appeal_control": "meiwaku_feedback"
  }
}
