{
  "card_id": "xai_s11_cocreation_001",
  "scenario_id": "S11",
  "audience": "instructor",
  "judgment": {
    "summary": "W7의 엔트로피 브리지 설명은 기존 강의 흐름을 보존하면서 3분 보강 자료와 확인 문제를 추가하는 방식이 가장 안전합니다.",
    "decision_type": "draft",
    "confidence": 0.79
  },
  "evidence": [
    {
      "source_event": "evt_s11_content_gap_001",
      "claim": "집계 기준으로 선행 개념 공백이 반복됩니다.",
      "weight": 0.55
    },
    {
      "source_event": "evt_s11_draft_generate_001",
      "claim": "Teaching Profile 제약을 반영한 초안이 생성되었습니다.",
      "weight": 0.45
    }
  ],
  "model": {
    "name": "course_cocreation_policy",
    "version": "0.1.0",
    "run_id": "run_s11_cocreation_001"
  },
  "uncertainty": {
    "summary": "효과는 S01 측정과 연결해 확인해야 하며, 다른 강의로 일반화하지 않습니다.",
    "interval_or_reason": "draft_quality_review_required"
  },
  "recommended_action": {
    "action_id": "act_s11_publish_bridge_variant",
    "label": "Teaching Profile에 맞춘 엔트로피 브리지 초안을 검토 후 게시합니다.",
    "owner": "instructor",
    "requires_approval": true
  },
  "measurement_plan": {
    "measurement_id": "measure_s11_draft_effect_001",
    "metric": "checkpoint_correct_rate_delta",
    "method": "pre_post",
    "reevaluate_at": "2026-04-25T09:00:00+09:00"
  },
  "governance": {
    "data_scope": ["content.gap.detect", "content.draft.generate"],
    "privacy_level": "aggregate",
    "approval_gate": "G2",
    "appeal_control": "instructor_override"
  }
}
