{
  "card_id": "xai_s01_instructor_intervention_001",
  "scenario_id": "S01",
  "audience": "instructor",
  "judgment": {
    "summary": "W7 Lecture 2의 22% 구간은 Gini와 Entropy 비교 설명 직후 확인 문제 흔들림이 반복되어, 짧은 선행 개념 보강 자료를 추가할 가치가 있습니다.",
    "decision_type": "draft",
    "confidence": 0.81
  },
  "evidence": [
    {
      "source_event": "evt_s01_video_pause_001",
      "claim": "22% 구간의 멈춤/재시청이 같은 강의 평균보다 높습니다.",
      "weight": 0.36
    },
    {
      "source_event": "evt_s01_checkpoint_submit_001",
      "claim": "엔트로피 정의 확인 문제에서 오답 선택이 집중되었습니다.",
      "weight": 0.34
    },
    {
      "source_event": "evt_s01_inference_001",
      "claim": "집계 기준 선행 개념 보강이 가장 낮은 후회 비용을 보였습니다.",
      "weight": 0.3
    }
  ],
  "model": {
    "name": "course_intervention_policy",
    "version": "0.1.0",
    "run_id": "run_s01_intervention_001"
  },
  "uncertainty": {
    "summary": "표본은 강의 집계 단위이며, 학생 개인별 원인을 단정하지 않습니다.",
    "interval_or_reason": "expected_rewatch_delta=-12% to -28%"
  },
  "recommended_action": {
    "action_id": "act_s01_entropy_bridge_publish",
    "label": "엔트로피 정의 브리지 설명과 확인 문제 1개를 W7 Lecture 2 앞에 추가합니다.",
    "owner": "instructor",
    "requires_approval": true
  },
  "measurement_plan": {
    "measurement_id": "measure_s01_intervention_effect_001",
    "metric": "segment_rewatch_rate_and_checkpoint_delta",
    "method": "switchback",
    "reevaluate_at": "2026-04-24T10:00:00+09:00"
  },
  "governance": {
    "data_scope": ["video.segment.pause", "checkpoint.answer.submit", "inference.struggle.detect"],
    "privacy_level": "aggregate",
    "approval_gate": "G2",
    "appeal_control": "instructor_override"
  }
}
